Question;Reponse
${LRED}Itil${RESTORE} c’est quoi ?;Collection de livres qui traite des bonnes pratiques dans la gestion des services informatiques
Quels sont les noms des 5 ouvrages ?;Strategie de Services, Conception des services, Transition des services, Exploitation des services et Amelioration continue des services.
Comment un service cree de la valeur ? ;En etant utile (amelioration perf ou suppression contraintes) et utilisable (capacite, disponibilite, continuite et disponibilite suffisante)
Un service c’est quoi ? ;C’est un moyen de fournir de la valeur au client sans qu’il n’en support les coûts ni les risques.
La gestion de services c’est quoi ? ;Ensemble de dispositions permettant de fournir de la valeur au client sous forme de service. On a les fonctions et les processus.
Quels sont les acteurs d’un service ?;Le fournisseur, le client, l’utilisateur, le proprietaire et le gestionnaire.
Citez-moi les differents types de fournisseur de services ? ;Interne (type 1), partage (type 2) et externe
Cite moi aux moins 4 caracteristiques d’un processus ? ;Un ou des elements definis en entres, un ou des elements en sortis qui peuvent être en entree d’un autre, mesurable (kpi, csf), un ou des resultats attendus, un ou des clients, un ou des declencheurs. 
L’efficacite et l’efficience c’est quoi ? ;Objectifs atteints et efficience c’est l’efficacite au moindre coup (ressources moindres, etc…)
Quelle est la difference entre un service et un projet informatique ?;Un projet est une implementation purement technique, non tournee vers le client alors que le service sera beaucoup plus tourne vers le client avec des notions de qualite de service, une amelioration continue, une maitrise de bout en bout. Dans l’implementation d’un service, nous avons une phase projet.
Une fonction c’est quoi?;Ensemble de personnes agissant pour un certain type de travaux. Ces personnes executeront un certain nombre d’activites relatives a un ou plusieurs processus.
Quelles sont les 4 fonctions et leurs definitions definies dans ITIL ?;REPONSE ==> Centre de services qui sera le point de contact unique pour les utilisateurs\n==> La gestion technique en charge de la MCO des systemes informatiques (N2 et N3 prod)\n==> La gestion des applications en charge de la MCO des applications (N2 et N3 applicatifs)\n==> La gestion des operations qui consiste a la realisation d’activite operationnelle (MG avec la clim, les badges, le centre electrogene, l’equipe en charge des rotations k7 sauvegardes, agent de supervision)
Un rôle c’est quoi et sur quel outil on s’appuie pour les definir ?;Il s’agit d’une responsabilite, consigne etc. a un instant t pour une activite donnee. C’est le modele RACI qui determine les rôles de chacun dans les differents services, processus, taches, activites etc. « Chacun » peut-être une fonction, une personne, le responsable ou gestionnaire d’un processus ou services… 
Pouvez-vous me decrire la signification des lettres R.A.C.I et dans quels cas c'est utilise ? ;REPONSE ==> R = Responsible qui va correspondre a celui qui realise la tâche\n==> A = Accountable qui est le responsable de R. Il approuve et valide les actions de R et doit rendre des comptes\n==> C = Consulted qui correspond a un expert, preferable externe qui pourra assister R\n==> I = Informed qui doit être tenu au courant de tout ce qui se passe.
L’etude des services a proposer aux clients s’effectue dans quelle publication ?;Strategie de services
La definition des metriques a mettre en œuvre pour surveiller la qualite des services se passe dans quelle publication ?;Conception des services notamment avec la gestion des niveaux de services qui nous servira de metrique.
La fourniture continue du service au client s’effectue a travers quelle publication ?;Exploitation des services qui permettra de faire ce qu’on appelle de la MCO.
La verification de l’impact des services et de la reussite de leur deploiement se passe dans quelle publication ?;Transition de services avec la gestion de l’evaluation des changements et de la validation et des tests.
Pour une bonne reussite de la strategie de service, quels sont les 4 P et les expliquer ?;REPONSE ==> Perspective qui signifie que dans notre reflexion sur les services, il faut penser a demain, vision d’avenir.\n ==> Perennisation : On fera en sorte que notre service soit durable. On ne va pas se dechirer sur un truc termine dans 1 an.\n ==> Positionnement : S’assurer que nous sommes bien places face a la concurrence (tarifs, elements differentiateurs...)\n ==> Plan : Planifier les actions a suivre pour parvenir a ses objectifs. 
Quels sont les processus de la strategie de service ?;Definition de la strategie, gestion du portefeuille de service, gestion des demandes, gestion financieres et gestion de la relation metier. 
Que contient le portefeuille de service ?;Services retires, Pipeline de service, Services a l’etude (encore au stade de la strategie), catalogue de service et les services actuels (même chose que catalogue).
À quoi sert le processus « Gestion de la demande » ? ;Connaitre les besoins clients, Adapter la strategie de service, eliminer toutes incertitudes dans la demande cliente. 
Que permet le processus « Gestion de la relation metier » de la strategie de service ?;Maintenir une relation de confiance avec les clients pour garantir la satisfaction generale ressentie
Le ROI c’est quoi ?;C’est le retour sur investissement. Il s’agit d’une duree apres laquelle le service rapporte de l’argent.
TCO, Cout et prix d’un service, expliquez-moi tout ça svp;Le TCO (Total cost Ownership) est ce que nous coûte la conception du service en prenant compte ce que l’on possede deja et combien il nous coutera pour le maintenir. Le cout d’un service represente ce qu’on a dû depenser pour le concevoir et le prix, son prix de vente (cout + marge). 
Quels sont les processus de la conception de services ?;Gestion de la securite informatique, de la continuite, disponibilite, capacite, fournisseurs, catalogue de service, les niveaux de services (sla) et la coordination de la conception.
Quels sont les 4 P a preparer et planifier de maniere efficace et efficience pour une bonne conception de services ? ;REPONSE ==> Personnes (Utiliser les meilleures ressources en fonction du besoin)\n==> Processus (Creer des nouveaux processus et adapter ceux deja en place avec l’evolution des services proposes)\n==> Produits (On choisit des produits adaptes a notre besoin actuel et futurs, dont le support sera au moins maintenu pendant la duree de fourniture du service…)\n==> Partenaires (On va s’assurer qu’ils vont durer dans le temps, qualite et adaptes aux besoins). 
Le SLR c’est quoi ?;Il s’agit du document relatant des exigences du client en matiere de qualite de service. Ça fait partie du package de demande client. 
Dans la conception de services, on va decider de comment on va realiser/fournir/exploiter et maintenir le service. À quoi correspondent le Co-Sourcing et l'outsourcing ? ;Le co-sourcing est l’exploitation et la connaissance partagee en interne et externe. L'outsourcing c’est l’exploitation en externe (infogerance). 
Dans la conception de services, dans quel processus intervient le chef de projet ?;Dans la coordination de la conception. 
Quelle est la difference entre la gestion de la disponibilite et de la continuite ? ;Dans la gestion de la disponibilite, on va s’assurer que le service soit livre dans le respect des SLA en matiere de disponibilite. Dans la gestion de la continuite, on va s’assurer que le service soit toujours livre en respectant les SLA mais cette fois-ci dans un environnement degrade suite a un sinistre majeur côte client ou DSI.
Un SLA c’est quoi et dans quel processus est-il defini ? ;Il s’agit d’un accord de service sur les exigences fonctionnelles et operationnelles. C’est une reponse que l’on apporte a une demande cliente. La gestion des SLA intervient dans le processus « gestion des niveaux de services » de la conception de services. 
Un SLR c’est quoi ? ;SLR (Service level requirement) correspond a la demande cliente. Il est utilise pour la redaction des SLA. 
OLA et UC c’est quoi . Differences ? ;REPONSE ==> OLA (Operationnal Level Agreement) et un accord de niveau de service avec un fournisseur interne. Il est generalement dispense d’indemnites financieres.\n==> L’UC (Underpinning Contract ou contrat de sous-traitance) est un accord de niveau de service avec les fournisseurs externes. Ici on a des penalites financieres d’inscrites. Ces deux elements interviennent dans la conception des SLA. 
PCA et PRA c’est quoi ? ;REPONSE ==> PCA = Plan de continuite d’activite. Il est decrit et teste dans le processus gestion de la continuite. Il permet de definir les etapes a suivre selon des risques predefinis afin de continuer les activites de service. À la fin d’un PCA nous sommes en environnement degrade.\n==> Le PRA (plan de reprise d’activite) definit les etapes a suivre afin de revenir a un fonctionnement optimal avant la venue du sinistre majeur. 
Que permet de processus « Gestion de la capacite » dans la conception de services ? ;S’assurer que les services actuels et futurs continueront d’être livres dans le respect des SLA malgre l’augmentation des services proposes, les mouvements de la DSI, evolution stockage, cpu… ça implique d’avoir une bonne connaissance des composants de l’infrastructure.
La gestion de la capacite dans la conception de services est divisee en 3 sous processus. Quels sont-ils et decrivez-les-moi ? ;REPONSE ==> BCM (Business Capacity management) est un processus qui va verifier la capacite orientee metiers. Nous sommes ici dans les futurs besoins, en lien avec la strategie de services (va eviter de definir des services pour lesquelles nos capacites sont proches de 0, on a tout a faire). \n ==> SCM (Service Capacity management) : ici nous sommes sur les performances. On va verifier que les perfs sont la avec tous les mouvements/evolutions de services qu’il peut y avoir. Ici on aura la notion de rapports mensuels sur differents points de l’infra (cpu, stockage, nb serve, mem…). \n ==> CCM (Component Capacity management) : ce processus va s’assurer que nous disposons bien de toutes les ressources materiels/humaine pour continuer a fournir les services actuels et futurs avec leurs evolutions dans le respect des SLA. En sortie on peut avoir des recrutements, achat de matos, logiciels, montees de version…
Que signifie CIA et dans quel processus intervient-il ?;Confidentialite, integrite et disponibilite (availability). Ça intervient dans la gestion de la securite de la conception de services. 
Le catalogue de service c’est quoi ? ;Document regroupant l’ensemble des services en cours. Il est contenu dans le portefeuille de service. Il est divise en 2 documents.\n==> Un doc au langage client\n==> Un doc plus technique où on y retrouvera toutes les infos techniques du service, qui doit rester pour le fournisseur de services.
La fiabilite c’est quoi ? ;Aptitude d’un equipement, logiciel ou service a fonctionner durablement avec un nombre minimum d’interruption ou incidents.
La maintenabilite c’est quoi ? ;Aptitude d’un equipement, service ou logiciel a être remis en marche apres un eventuel incident.
La resilience c’est quoi ? ;On parlera de resilience pour un equipement. Il s’agit de sa capacite a continuer de fonctionner malgre des composants HS (Alim redondee, multi cpu…).
Recoverability c’est quoi ? ;C’est l’aptitude pour un equipement, service a s’auto reconfigurer jusqu’au dernier niveau d’arrêt.
La non-repudiation c’est quoi ? ;C’est assumer le fait d’avoir effectue une action. On ne peut pas nier. Tres important pour les entreprises manipulant des donnees sensibles. Si ça ne peut pas être prouve, c’est le responsable/P.D.G. qui est coupable. 
Dans la gestion de la continuite, il y a la partie technique mais egalement la partie business. Pouvez-vous me parler du business Continuity Plan ? ;Il s’agit d’un plan oriente direction qui va dicter quels seront les services a maintenir en cas de sinistre majeur. Il faudra faire des choix, on ne pourra pas tout remonter, faudra definir des priorites… C’est dans ce plan que c’est defini. Slide 56
L’authenticite c’est quoi ? ;C’est rendre fiable les echanges en introduisant une signature electronique. Est-ce-que je parle a la bonne personne ?
Que permet la phase de transition des services ?;Elle va definir un cadre a respecter afin de preparer l’implementation ou l’evolution de services pour le client. On s’assurera que le service pourra être utilisable par les utilisateurs (doc), on s’assurera que ça repond bien au besoin, que les performances sont la… Des phases de planification devront être respectees avec des livrables a produire. En quelques mots : Realisation, Construction, Tests, validation, deploiement, coordination
Quels sont les processus de la transition des services ?;REPONSE ==> La gestion de la planification et le support a la transition (Coordination des equipes si plusieurs interventions lors du changement, reservation des ressources \n ==> La gestion de l’evaluation des changements : Avoir une analyse proactive de la modification ou ajout d’un service sur l’existant. Permettra de limiter les impacts non prevus, redaction d’une PIR si necessaire qui sera reutilisee pour un second deploiement… \n ==> La validation et les tests : Va definir un certain nombre de preuves a rassembler une fois le deploiement effectue afin de s’assurer que l’utilite et les garanties convenues sont bien respectees. On redigera des PV de recette fonctionnelles (utilite), de performances, d’exploitabilite… \n ==> La gestion de la connaissance : S’assurer que les utilisateurs seront bien formes pour le nouveau service ou sa MAJ et qu’il pourra obtenir les informations qu’il souhaite quand il le demande. Ça passera par une formation des equipes supports N1, N2 et N3 (Procedures, Manex, FAQ) \n ==> La gestion des mises en production et des deploiements : va industrialiser la mise en œuvre du changement le jour J. Procedures, etapes, suivi temporel … Va reprendre certains points de la gestion de la connaissance en produisant des livrables a destination des supports et utilisateurs. \n ==> La gestion des changements : Processus central de la transition des services. Il va coordonner toutes les etapes validant plusieurs points dans le processus de changements. Enregistrement du changement, evaluation, autorisation ou pas ? Realisation, integration et deploiement cadre par des procedures... Chef d’orchestre \n ==> La gestion des actifs de services et de configuration : Processus en charge de maintenir la CMDB du CMS a jour lors de l’implementation ou le MAJ de services. (CI ordinateurs, logiciels, licences, composants, docs, sources) 
Big Bang, phase (lot), push, pull, automatique et manuel… Que signifient ces termes et dans quel processus ils intervient ? ;Big bang et phase sont des modes de deploiement (tout le monde ou par phase en creant des lots). Les modes Push et Pull sont des techniques de deploiement pour l’utilisateur. On utilisera le plus souvent Push qui installera en automatique l’application. Cependant, on pourra faire du Pull qui mettra dans un portail applicatif l’application qui pourra être installee au bon vouloir de l’utilisateur. Nous sommes toujours sûrs de l’installation automatique permettant des installations homogenes pour tous les postes et reduisant les erreurs et le temps (pas d’intervention utilisateur ou de techniciens). On a ensuite le mode manuel qui revient a se deplacer ou le faire un distant (clic, clic…). Tous ces termes interviennent dans la gestion des mises en production et des deploiements de la transition de service.
Un CI c’est quoi ? citez-m'en 5;CI = Configuration item. Ce sont des elements de configuration logiciel/materiels… qui interviennent dans la fourniture du service. Il dispose de plusieurs attributs. Ordinateurs, logiciels, licence, contrat de garantie, switch, sites, … Tous ces CI ont ensuite des attributs comme des noms, n° de serie, lieux… 
Une baseline c’est quoi ? ;Il s’agit d’un CI dans son fonctionnement normal. Tres important d’en avoir connaissance surtout pour la gestion des evenements dans l’exploitation des services.
Un CMS c’est quoi ? ;Systeme de gestion de la configuration. Va contenir plusieurs CMDB avec differents CI
Comment s'appelle la bibliotheque des CI logiciels ? ;La DML (Definitive Media Library). C’est une structure contenant les logiciels utilises dans l’infrastructure.
Une RFC, c’est quoi ? ;Request for Change : Il s’agit d’un ensemble de documents formalisant la modification d’un ou plusieurs CI. Ces RFC pourront concerner soit un changement Normal, standard (geste d’exploitation => Gestion des requêtes dans l’exploitation des services) ou urgent. 
CAB/ECAB, ça signifie quoi ? Quand intervient-il ? ;Il s’agit de comites qui valide les RFC ou non. Le cab (change advisor board) intervient pour les changements normaux, l’ECAB (e=emergency) pour les changements urgents. Les changements standards ne sont pas concernes dans la gestion des changements car ils sont pre-autorises.
Le PIR, ça signifie quoi et quand intervient-il ? ;PIR = Post implementation revew. C’est un document qui intervient apres le changement pour analyser les resultats des differentes MEP des changements. Dans certains cas il n’est utilise uniquement pour les echecs. 
Citez-moi les 7R du processus gestion de changements ?;Il s’agit des 7 questions qui doivent avoir une reponse afin de correctement sequencer son changement.  Raised = qui - Raeson = Raison - Return = Retour attendu - Risks = risques - Ressources = Ressources necessaires - Responsable = le responsable - Relationship = les relations avec les autres changes.
Le SKMS, expliquez-moi a quoi ça correspond et quand est-il utilise ? (Processus).;Il s’agit du systeme de gestion de la connaissance. Il est utilise lors du processus « gestion de la connaissance » de la transition de service. Il va contenir un ensemble de documents a destination des utilisateurs afin qu’ils puissent y trouver les informations necessaires sur le fonctionnement du service… Sont egalement concernes les equipes supports. 
Comment se nomme en langage itil le lieu de stockage du materiel informatique ? ;DHS (Definitive Hardware Store).
Quelles sont les caracteristiques d’un changement standard ? ;Il est pre-autorise par le processus de gestion des changements, son coût est connu et ses risques induits sont negligeables. 
Quelles sont les differences entre la gestion des incidents et la gestion des problemes ?;Dans la gestion des incidents, on va faire de la priorisation, gestion et retablir un service dans la limite des SLA. Dans la gestion des problemes, On fera de la prevention d’incident en determinant la cause. En gestion d’incident on fournit des solutions de contournement alors qu’en gestion de probleme des solutions definitive en determinant les causes. Ainsi ça va permettre a un service de revenir a un fonctionnement normal. 
Comment s’appelle la BDD des erreurs connues ? ;KEDB (Key error Database) 
Quel est le rôle de l’exploitation des services ? ;Fournir 100% du service au client. On appelle ça de la MCO (Maintien en condition operationnelle). Devront egalement sortir de l’exploitation des services des indicateurs afin de pouvoir faire de l’amelioration continue.
Dans l’exploitation des services, quelles sont les differences entre la reactivite et la proactivite ? ;En reactivite, nous n'agirons qu’en fonction des evenements (incident, dmd, probleme, change…). En proactivite, en best effort, on va s’investir afin de proposer/faire des ameliorations pour de l’optimisatio
Quels sont les processus de la phase d’exploitation des services ? ;Execution des requêtes, gestion des evenements, gestion des acces, gestion des problemes et gestion des incidents.
Pouvez-vous me citer les 4 fonctions itil et pour chacune d’elles faire les bonnes associations avec les termes suivants : Support N1, support N2 et N3, Moyens Generaux/proximite ?;Centre de services => Support N1 - Gestion technique et gestion des applications => Support N2 et Supporte N3 - Gestion des operations => Moyens Generaux/proximite
Pour la fonction « centre de service », pouvez-vous me donner les 3 concepts de centre de services avec les exemples d’utilisation ? ;Centre d’appels pour les tres grandes structures ayant besoin de traiter des tres grandes quantites d’appels. C’est du N0, de l’aiguillage, prise d’info pure. \n Helpdesk, centre d’assistance : appele N1, c’est un premier niveau de resolution. Gestion de panne, resolution, suivi des dmd/incidents, uniquement de la reactivite. \n - Service desk/centre de service : C’est un helpdesk avance effectuant des actions de proactivites. Niveau 1.5, competences plus larges… 
Comment est determinee la priorite d’une dmd/incident ?;C’est la resultante d’un impact et d’une urgence selon une matrice. 
Remettez dans l’ordre les actions suivant que doit realiser une personne du centre de services . Categorisation – Ouverture du ticket – suivi de l’appel – Escalade vers les grp sup N2 – Codification – Prise en compte de l’appel – Enregistrement des infos utilisateur – Investigation et diagnostique – Reponse a l’utilisateur – Clôture ticket – MAK base de co – Gestion satisfaction client;1-Prise en compte de l’appel \n 2-Ouverture du ticket \n 3-Enregistrement des infos utilisateur (id, nom, prenom, matricule, objet dmd…) \n 4-Categorisation (inc ou dmd) \n 5-Codification (Definir un delai en fonction de la priorite) \n 6-Investigation et diag (Apport de la VA, reformulation demande, 1er diag) \n 7-Reponse a l’utilisateur (1re reponse : Soit resolution ou alors on va escalader aux personnes competentes…) \n 8-Escalade vers les grp sup si necessaire \n 9- suivi du ticket, tenir informe l’utilisateur de l’avance de son ticket. \n 10-Clôture du ticket par le centre de services même s’il y a eu escalade \n 11-Gestion des enquêtes de satisfaction \n 12-Mise a jour de la base de Co (skms, modification CI)
Quels sont les 4 types d’architecture de centre de services ? ;Local, centralise, virtuel et qui suit le soleil
Expliquer moi le fonctionnement du centre de services local ?;Il s’agit d’un centre implemente sur tous les sites d’une entreprise. Beaucoup de proximite avec les utilisateurs, tres apprecie, grosse reactivite mais tres couteuse, pas de partage des connaissances avec les autres centres de services locaux de l’entreprise, pas de gestion de charge… 
Expliquer moi le fonctionnement du centre de services centralise ?;Il est implante sur un site et utilise par tous les sites de l’entreprise. Il peut être externalise par une entreprise. Mutualisation des ressources, moyens, connaissances, procedures homogenes… Cependant aucune proximite avec les utilisateurs, moins de reactivite, frustration … Quelques parades avec les outils de prise en main a distance, l’implementation de techniciens de proximite sur les sites, faire du mixe local/centralise…
Expliquez-moi le fonctionnement du centre de services virtuel ?;Un point de contact unique (SVI) qui aiguille sur des centres de services centralises propres a une fonction ou un lieu. Avantage au niveau des barrieres de la langue, resolution + efficace si appels rediriges en fonction du sujet… En revanche techniquement ça demande plus d’outils, des CTI, SVI et on rencontre quelques soucis des centres de services locaux notamment sur la coordination entre les differents centres. L’utilisation de responsable est une obligation. Pas de h24 ici. 
Expliquez-moi le fonctionnement du centre de services qui suit le soleil ? ;C’est un virtuel avec une prise en compte H24 et donc une repartition dans les 4 coins du monde pour couvrir toute une journee.
Dans la gestion des evenements, quels sont les 4 types d’evenements ? ;Normal : Survient quand le CI est dans sa baseline par ex (Charge cpu proxy ecole 13 h) - Exception : c’est anormal, peut se transformer en incident, ne degrade pas forcement la qualite du service offert (Replication entre SiteAD qui marche par intermittence. Tant qu’il n’y a pas de changement de Mdp c’est bon) - Avertissement : quand un seuil d’avertissement que l’on aura defini sur un CI est franchi (Bande Passante necessaire pour les virements en warning) - Alerte : C’est une exception avec intervention obligatoire (Le serveur applicatif ne repond plus) 
